<?xml version="1.0" encoding="UTF-8"?>
<xs:schema xmlns:xs="http://www.w3.org/2001/XMLSchema" elementFormDefault="qualified">
<xs:annotation>
  <xs:documentation xml:lang="ca">
    Exercici6. Una empresa pretén guardar la informació dels seus empleats en xml. 
    Fes un esquema per poder modelar-ho creant nou tipus de dades. S'ha de guardar 
    el nom de l'empleat i un identificador únic com atribut, la data d'inici del contracte, 
    el lloc que ocupa i els llocs que ha ocupat, el seu cap directe com una relació amb l'ID, 
    el que cobra, tots els seus títol acadèmics, la seu en que treballa d'entre les 
    tres possibles Madrid, Barcelona, València; finalment s'ha de guardar un camp que 
    siguin observacions on també hi pot haver altres etiquetes com merits, demerits. 
    Fes també un document que s'hi ajusti amb al menys 5 empleats.
    Fe un captura de pantalla amb el document validat amb un validador.

  </xs:documentation>
</xs:annotation>

<xs:element name="empleats">
  <xs:complexType>
    <xs:sequence>
      <xs:element name="empleat" maxOccurs="unbounded">
        <xs:complexType>
          <xs:sequence>
            <xs:element name="dataInici">
              <xs:complexType>
                <xs:sequence>
                  <xs:element name="dia">
                    <xs:simpleType>
                      <xs:restriction base="xs:int">
                        <xs:maxInclusive value="31"></xs:maxInclusive>
                        <xs:minInclusive value="1"></xs:minInclusive>
                      </xs:restriction>
                    </xs:simpleType>
                  </xs:element>
                  <xs:element name="mes">
                    <xs:simpleType>
                      <xs:restriction base="xs:int">
                        <xs:maxInclusive value="12"></xs:maxInclusive>
                        <xs:minInclusive value="1"></xs:minInclusive>
                      </xs:restriction>
                    </xs:simpleType>
                  </xs:element>
                  <xs:element name="any">
                    <xs:simpleType>
                      <xs:restriction base="xs:int">
                        <xs:maxInclusive value="9999"></xs:maxInclusive>
                        <xs:minInclusive value="1000"></xs:minInclusive>
                      </xs:restriction>
                    </xs:simpleType>
                  </xs:element>
                </xs:sequence>
              </xs:complexType>
            </xs:element>
            <xs:element name="lloc" type="xs:string" minOccurs="0"></xs:element>
            <xs:element name="sou" type="xs:int" minOccurs="0"></xs:element>
            <xs:element name="titulacio" type="xs:string" maxOccurs="unbounded" minOccurs="0"></xs:element>
            <xs:element name="seu" type="xs:string" minOccurs="0"></xs:element>
            <xs:element name="lloc" type="xs:string" minOccurs="0"></xs:element>
            <xs:element name="llocPrevi" type="xs:string" minOccurs="0" maxOccurs="unbounded"></xs:element>
            <xs:element name="observacions" minOccurs="0"></xs:element>
          </xs:sequence>
          <xs:attribute name="codi" type="xs:string"></xs:attribute>
          <xs:attribute name="nom" type="xs:string"></xs:attribute>
          <xs:attribute name="cap" type="xs:string"></xs:attribute>
        </xs:complexType>
      </xs:element>
    </xs:sequence>
  </xs:complexType>
</xs:element>



</xs:schema>
