<?xml version="1.0" encoding="UTF-8"?>
<empleats xmlns:xsi="http://www.w3.org/2001/XMLSchema-instance" xsi:noNamespaceSchemaLocation="exercici5.xsd">
  <empleat codi="x12323892s" nom="Jordi Bellvé Soler">
    <dataInici>
      <dia>01</dia>
      <mes>09</mes>
      <any>1987</any>
    </dataInici>
  <lloc>Propietari</lloc>
  <sou>5000</sou>
  <titulacio>Empresarials UAM</titulacio>
  <seu>Madrid</seu>
  </empleat>
  
  <empleat codi="x81753892p" nom="Isabel Bellvé Smith" cap="x12323892s">
    <dataInici>
      <dia>22</dia>
      <mes>12</mes>
      <any>2003</any>
    </dataInici>
  <lloc>Cap Barcelona</lloc>
  <sou>3200</sou>
  <titulacio>Economia UB</titulacio>
  <seu>Barcelona</seu>  
</empleat>

<empleat codi="x11766592t" nom="Ana Sort Llof" cap="x81753892p">
    <dataInici>
      <dia>22</dia>
      <mes>12</mes>
      <any>2000</any>
    </dataInici>
  <lloc>Secretaria de la cap de Barcelona</lloc>
  <sou>1100</sou>
  <titulacio>Batxillerat </titulacio>
  <titulacio>Técnico Gestión Administrativa</titulacio>
  <seu>Barcelona</seu>
  <llocPrevi>Secretaria de logística de Barcelona</llocPrevi>  
  <observacions>Disponibilitat de viatjar. Casada amb un fill. 
    <merit>Sol veure quan un negociador no diu la veritat </merit>
    <merit>Sol treballar molt ràpid i bé</merit>
    <demerit>Unes poques vegades, per motius aliens a la feina, ha estat molt agitada i nerviosa i no ha rendit bé</demerit>  
  </observacions>
</empleat>

<empleat codi="x51766502t" nom="Ramón Soltono Visalte" cap="x81753892p">
    <dataInici>
      <dia>10</dia>
      <mes>02</mes>
      <any>1999</any>
    </dataInici>
  <lloc>Operari de embalatge</lloc>
  <sou>600</sou>
  <titulacio>Tecnico en Embalaje</titulacio>
  <seu>Barcelona</seu> 
  <llocPrevi>Operari varis</llocPrevi>
  <llocPrevi>Encarregat de logística</llocPrevi> 
  <observacions>    
    <demerit>Si no hi ha algú que el vigila no treballa</demerit>  
  </observacions>
</empleat>

<empleat codi="x31766502t" nom="Amalia Dolita Tokil" cap="x81753892p">
    <dataInici>
      <dia>10</dia>
      <mes>10</mes>
      <any>2011</any>
    </dataInici>
  <lloc>Operari varis</lloc>
  <sou>950</sou>  
  
  <seu>Barcelona</seu>  
  
</empleat>



</empleats>